{
  "GatewayBindingRef": "capability://urban.object.related_search",
  "CapabilityID": "urban.object.related_search",
  "Owner": "udp",
  "OperationClass": "SEARCH",
  "Arguments": {"anchorObjectId": "fd971091-2b0d-4daf-977a-81509056315a", "anchorTypeCode": "DEHOR", "relationIri": "https://example.test/relatedTo", "direction": "OUTBOUND", "targetTypeCodes": ["CIVICO"], "limit": 10},
  "Identity": {"ServicePrincipalID": "ouf-mcp-server", "PrincipalID": "agent-1", "TenantID": "tenant-1", "ActorType": "AI_AGENT", "AuthenticationContextRef": "authn-1"},
  "AuthorizationDecisionRef": "decision-1",
  "CorrelationID": "correlation-1",
  "IdempotencyKey": "idempotency-1",
  "AttemptID": "321946e1-8f6f-4091-92a5-7ddce63329a7",
  "RequestHash": "aaaaaaaaaaaaaaaaaaaaaaaaaaaaaaaaaaaaaaaaaaaaaaaaaaaaaaaaaaaaaaaa",
  "MaxResultBytes": 1048576
}
